{
  "schema_version": "1.0.0",
  "catalogue_version": "v1.6.0",
  "status": "current_public",
  "cards": [
    {
      "public_experience_id": "GRW-EXP-001",
      "legacy_public_identifier": "KGE-001",
      "card_path": "assets/public-experience-derivatives/cards/GRW-EXP-001.md",
      "primary_public_topic": "GRW-TOP-001",
      "optional_secondary_topics": [],
      "status": "current_public_guidance"
    }
  ]
}
